{
  "$schema" : "https://json-schema.org/draft/2020-12/schema",
  "$id" : "https://ikasan.org/studio/model.schema.json",
  "title" : "Ikasan Studio module model",
  "type" : "object",
  "properties" : {
    "applicationPackageName" : {
      "type" : "string",
      "minLength" : 1
    },
    "flowStartupType" : {
      "type" : "string"
    },
    "h2DbPortNumber" : {
      "type" : [ "string", "integer" ]
    },
    "h2WebPortNumber" : {
      "type" : [ "string", "integer" ]
    },
    "name" : {
      "type" : "string",
      "minLength" : 1
    },
    "port" : {
      "type" : [ "string", "integer" ]
    },
    "useEmbeddedH2" : {
      "type" : "boolean"
    },
    "version" : {
      "type" : "string",
      "minLength" : 1
    },
    "flows" : {
      "type" : "array",
      "items" : {
        "$ref" : "#/$defs/flow"
      }
    },
    "modelFormat" : {
      "const" : "ikasan-studio-documents"
    },
    "formatVersion" : {
      "const" : 1
    },
    "module" : {
      "type" : "object",
      "required" : [ "name", "ikasanVersion", "flows" ],
      "properties" : {
        "name" : {
          "type" : "string"
        },
        "version" : {
          "type" : "string"
        },
        "ikasanVersion" : {
          "type" : "string"
        },
        "flows" : {
          "type" : "array",
          "items" : {
            "$ref" : "#/$defs/flow"
          }
        }
      }
    },
    "configuration" : {
      "type" : "array",
      "items" : {
        "type" : "object",
        "required" : [ "configurationId", "parameters" ],
        "properties" : {
          "configurationId" : {
            "type" : "string"
          },
          "implementingClass" : {
            "type" : "string"
          },
          "parameters" : {
            "type" : "array",
            "items" : {
              "type" : "object",
              "required" : [ "name", "value" ],
              "properties" : {
                "name" : {
                  "type" : "string"
                },
                "value" : { }
              }
            }
          }
        }
      }
    },
    "studio" : {
      "type" : "object",
      "required" : [ "metaPack", "properties", "flows" ],
      "properties" : {
        "metaPack" : {
          "type" : "string"
        },
        "properties" : {
          "type" : "object"
        },
        "flows" : {
          "type" : "object",
          "additionalProperties" : {
            "type" : "object",
            "required" : [ "properties", "components" ],
            "properties" : {
              "properties" : {
                "type" : "object"
              },
              "components" : {
                "type" : "object",
                "additionalProperties" : {
                  "type" : "object",
                  "required" : [ "component", "properties" ],
                  "properties" : {
                    "component" : {
                      "type" : "string"
                    },
                    "properties" : {
                      "type" : "object"
                    }
                  }
                }
              }
            }
          }
        }
      }
    }
  },
  "additionalProperties" : true,
  "$defs" : {
    "component" : {
      "type" : "object",
      "required" : [ "componentName", "componentType", "implementingClass" ],
      "properties" : {
        "componentName" : {
          "type" : "string",
          "minLength" : 1
        },
        "componentType" : {
          "type" : "string",
          "minLength" : 1
        },
        "implementingClass" : {
          "type" : "string"
        },
        "additionalKey" : {
          "type" : "string"
        }
      },
      "additionalProperties" : true
    },
    "transition" : {
      "type" : "object",
      "required" : [ "from", "to", "name" ],
      "properties" : {
        "from" : {
          "type" : "string",
          "minLength" : 1
        },
        "to" : {
          "type" : "string",
          "minLength" : 1
        },
        "name" : {
          "type" : "string",
          "minLength" : 1
        }
      },
      "additionalProperties" : false
    },
    "exceptionResolution" : {
      "type" : "object",
      "required" : [ "exceptionsCaught", "action" ],
      "properties" : {
        "exceptionsCaught" : {
          "type" : "string",
          "minLength" : 1
        },
        "action" : {
          "type" : "string",
          "minLength" : 1
        },
        "actionProperties" : {
          "type" : "object"
        }
      },
      "additionalProperties" : true
    },
    "flow" : {
      "type" : "object",
      "required" : [ "name" ],
      "properties" : {
        "name" : {
          "type" : "string",
          "minLength" : 1
        },
        "consumer" : {
          "$ref" : "#/$defs/component"
        },
        "transitions" : {
          "type" : "array",
          "items" : {
            "$ref" : "#/$defs/transition"
          }
        },
        "flowElements" : {
          "type" : "array",
          "items" : {
            "$ref" : "#/$defs/component"
          }
        },
        "exceptionResolver" : {
          "type" : "object",
          "description" : "Maps each caught exception class to its resolution.",
          "additionalProperties" : {
            "$ref" : "#/$defs/exceptionResolution"
          }
        }
      },
      "additionalProperties" : true
    }
  },
  "oneOf" : [ {
    "required" : [ "applicationPackageName", "name", "version", "flows" ],
    "not" : {
      "required" : [ "modelFormat" ]
    }
  }, {
    "required" : [ "modelFormat", "formatVersion", "module", "configuration", "studio" ]
  } ]
}