{"applicationPackageName":"org.example.rab","flowStartupType":"AUTOMATIC","h2DbPortNumber":"12411","h2WebPortNumber":"12412","name":"routesAndBranches","port":"12410","useEmbeddedH2":true,"version":"V3.3.9","flows":[{"name":"Splitter Flow","consumer":{"componentName":"Periodic Event Initiator","cronExpression":"0 * 0 * * ? *","componentType":"org.ikasan.spec.component.endpoint.Consumer","implementingClass":"org.ikasan.component.endpoint.quartz.consumer.ScheduledConsumer"},"transitions":[{"from":"Periodic Event Initiator","to":"Message Batch Generator","name":"default"},{"from":"Message Batch Generator","to":"Default Split list into individuals","name":"default"},{"from":"Default Split list into individuals","to":"Standard split list to string","name":"default"},{"from":"Standard split list to string","to":"Connect to next flow","name":"default"}],"flowElements":[{"componentName":"Message Batch Generator","fromType":"org.quartz.JobExecutionContext","requiresStub":true,"toType":"java.util.List<java.lang.String>","userImplementedClassName":"MessageGenerator","componentType":"org.ikasan.spec.component.endpoint.Broker","implementingClass":"org.ikasan.spec.component.endpoint.Broker"},{"componentName":"Default Split list into individuals","componentType":"org.ikasan.spec.component.splitting.Splitter","implementingClass":"org.ikasan.component.splitter.DefaultListSplitter"},{"componentName":"Standard split list to string","fromType":"java.lang.String","requiresStub":true,"toType":"java.lang.String","userImplementedClassName":"StandardSplitListToString","componentType":"org.ikasan.spec.component.splitting.Splitter","implementingClass":"org.ikasan.component.splitter.Custom"},{"componentName":"Connect to next flow","connectionFactoryJndiPropertyFactoryInitial":"org.apache.activemq.jndi.ActiveMQInitialContextFactory","connectionFactoryJndiPropertyProviderUrl":"vm://embedded-broker?create=true&broker.persistent=false&broker.useJmx=false","connectionFactoryName":"ConnectionFactory","destinationJndiName":"splitterflow","componentType":"org.ikasan.spec.component.endpoint.Producer","implementingClass":"org.ikasan.component.endpoint.jms.spring.producer.ArjunaJmsTemplateProducer"}]},{"name":"Filters Flow","consumer":{"autoContentConversion":true,"componentName":"connect to previous flow","connectionFactoryJndiPropertyFactoryInitial":"org.apache.activemq.jndi.ActiveMQInitialContextFactory","connectionFactoryJndiPropertyProviderUrl":"vm://embedded-broker?create=true&broker.persistent=false&broker.useJmx=false","connectionFactoryName":"ConnectionFactory","destinationJndiName":"splitterflow","componentType":"org.ikasan.spec.component.endpoint.Consumer","implementingClass":"org.ikasan.component.endpoint.jms.spring.consumer.JmsContainerConsumer"},"transitions":[{"from":"connect to previous flow","to":"Default filter every 5th","name":"default"},{"from":"Default filter every 5th","to":"filter every 4th","name":"default"},{"from":"filter every 4th","to":"Connect To Next flow","name":"default"}],"flowElements":[{"componentName":"Default filter every 5th","configuredResource":false,"fromType":"java.lang.String","requiresStub":true,"userImplementedClassName":"DefaultFilterRemoval","componentType":"org.ikasan.spec.component.filter.Filter","implementingClass":"org.ikasan.filter.DefaultMessageFilter"},{"componentName":"filter every 4th","configuredResource":false,"fromType":"java.lang.String","requiresStub":true,"userImplementedClassName":"NormalFilter","componentType":"org.ikasan.spec.component.filter.Filter","implementingClass":"org.ikasan.spec.component.filter.Filter.Custom"},{"componentName":"Connect To Next flow","connectionFactoryJndiPropertyFactoryInitial":"org.apache.activemq.jndi.ActiveMQInitialContextFactory","connectionFactoryJndiPropertyProviderUrl":"vm://embedded-broker?create=true&broker.persistent=false&broker.useJmx=false","connectionFactoryName":"ConnectionFactory","destinationJndiName":"filtersflow","componentType":"org.ikasan.spec.component.endpoint.Producer","implementingClass":"org.ikasan.component.endpoint.jms.spring.producer.ArjunaJmsTemplateProducer"}]},{"name":"Router Flow","consumer":{"autoContentConversion":true,"componentName":"connect to previous flow","connectionFactoryJndiPropertyFactoryInitial":"org.apache.activemq.jndi.ActiveMQInitialContextFactory","connectionFactoryJndiPropertyProviderUrl":"vm://embedded-broker?create=true&broker.persistent=false&broker.useJmx=false","connectionFactoryName":"ConnectionFactory","destinationJndiName":"filtersflow","componentType":"org.ikasan.spec.component.endpoint.Consumer","implementingClass":"org.ikasan.component.endpoint.jms.spring.consumer.JmsContainerConsumer"},"transitions":[{"from":"connect to previous flow","to":"Both routes get it","name":"default"},{"from":"Both routes get it","to":"Either Or Router","name":"route1"},{"from":"Either Or Router","to":"String to email 1","name":"odd"},{"from":"String to email 1","to":"output1","name":"default"},{"from":"Either Or Router","to":"String to email 2","name":"even"},{"from":"String to email 2","to":"output2","name":"default"},{"from":"Both routes get it","to":"String to email","name":"route2"},{"from":"String to email","to":"output 3","name":"default"}],"flowElements":[{"componentName":"Both routes get it","configuredResource":false,"fromType":"java.lang.String","routeNames":"[route1, route2]","toType":"java.util.List<java.lang.String>","userImplementedClassName":"MultiRecipient","componentType":"org.ikasan.spec.component.routing.MultiRecipientRouter","implementingClass":"org.ikasan.component.router.multirecipient.RecipientListRouter"},{"componentName":"Either Or Router","configuredResource":false,"fromType":"java.lang.String","routeNames":"[odd, even]","toType":"java.lang.String","userImplementedClassName":"EitherOrRouter","componentType":"org.ikasan.spec.component.routing.SingleRecipientRouter","implementingClass":"org.ikasan.spec.component.routing.SingleRecipientRouter"},{"componentName":"String to email 1","fromType":"java.lang.String","requiresStub":true,"userImplementedClassName":"StringToEmail1","componentType":"org.ikasan.spec.component.transformation.Converter","implementingClass":"org.ikasan.spec.component.transformation.Converter.Custom","additionalKey":"EmailConverter"},{"componentName":"output1","emailFormat":"text/plain","mailSmtpPort":1025,"mailSubject":"odd messages","toRecipient":"foor@bar.com","componentType":"org.ikasan.spec.component.endpoint.Producer","implementingClass":"org.ikasan.component.endpoint.email.producer.EmailProducer"},{"componentName":"String to email 2","fromType":"java.lang.String","requiresStub":true,"userImplementedClassName":"StringToEmail2","componentType":"org.ikasan.spec.component.transformation.Converter","implementingClass":"org.ikasan.spec.component.transformation.Converter.Custom","additionalKey":"EmailConverter"},{"componentName":"output2","emailFormat":"text/plain","mailSmtpPort":1025,"mailSubject":"even messages","toRecipient":"bar@bar.com","componentType":"org.ikasan.spec.component.endpoint.Producer","implementingClass":"org.ikasan.component.endpoint.email.producer.EmailProducer"},{"componentName":"String to email","fromType":"java.lang.Object","requiresStub":true,"userImplementedClassName":"StringToEmai","componentType":"org.ikasan.spec.component.transformation.Converter","implementingClass":"org.ikasan.spec.component.transformation.Converter.Custom","additionalKey":"EmailConverter"},{"componentName":"output 3","emailFormat":"text/plain","mailSmtpPort":1025,"mailSubject":"all messages","toRecipient":"x@yy.com","componentType":"org.ikasan.spec.component.endpoint.Producer","implementingClass":"org.ikasan.component.endpoint.email.producer.EmailProducer"}]}]}